http://forum.guitarplayer.ru/index.php?topic=219514.180	Shlyapa	 Один мой знакомый педагог с многлетним опытом говорил, что за всю свою практику он видел всего одного человека, действительно лишённого музыкального слыха. Все остальные имели музыкальный слух, просто был он нетренированным и у его обладателей не было навыков им пользоваться. 	False	False	0	1
http://forum.guitarplayer.ru/index.php?topic=219514.180	Hoop	 gena2279, фига ж тут интересного? **IMAGE** купил гитару, проблемы с настройкой....скачай програмный тюнер для компа или купи нормальный тюнер.....а то телевизор.....еще бы по шуму воды из крана настраивали **IMAGE** 	True	False	0	1
http://forum.guitarplayer.ru/index.php?topic=219514.180	Evgenii857752	 Статья для тех у кого абсолютно нет слуха , зато зрение суперское , чтобы увидеть колебания струн на экране телевизора ... 	False	False	-1	0
http://forum.guitarplayer.ru/index.php?topic=219514.180	Zodchy	 Приветствую, друзья! Столкнулся с такой проблемой. Перечитал много инструкций, как настроить мензуру (бридж - ТоМ). Не получается с третьей чисто настроить. Со всеми остальными струнами всё в порядке. Вот как не крути, квинта Е5 звучит очень грязно, как раз из-за этой третьей струны. Ползунок упёрся максимально к бриджу, и всё равно она звучит намного выше положенной частоты. Струны - Еликсир 10-52 У кого какие соображения? 	False	False	0	1
http://forum.guitarplayer.ru/index.php?topic=219514.180	Hoop	 Zodchy, Какая гитара, струны новые, если нет, то сколько им....как строишь?-по тюнеру или еще как? 	False	False	0	1
http://forum.guitarplayer.ru/index.php?topic=219514.180	Terravill	 Zodchy, переворачивай седла 	False	False	0	0
http://forum.guitarplayer.ru/index.php?topic=219514.180	Shlyapa	 Цитата: Terravill от Марта 05, 2012, 15:35:01 Zodchy, переворачивай седла Именно. У меня как раз на третьей перевёрнуто. 	False	False	0	0
http://forum.guitarplayer.ru/index.php?topic=219514.180	Evgenii857752	 Shlyapa, а если vintage tremollo 	False	False	0	0
http://forum.guitarplayer.ru/index.php?topic=219514.180	Shlyapa	 Evgenii857752, вопрос был про TOM. На него и ответ. А про тремолы не знаю — у меня их никогда не было, если не считать то, которое было в 1989 году на «Аэлите» в полковом ВИА. 	False	False	0	0
http://forum.guitarplayer.ru/index.php?topic=219514.180	Zodchy	 Цитата: Hoop от Марта 05, 2012, 15:28:13 Zodchy, Какая гитара, струны новые, если нет, то сколько им....как строишь?-по тюнеру или еще как? гитара Эпи Sg Special. Струнам около месяца. Настраиваю исключительно по тюнеру. Цитата: Terravill от Марта 05, 2012, 15:35:01 Zodchy, переворачивай седла то есть? не понял немного совета. Седло стоит наклонной поверхностью к бриджу 	False	False	0	1
http://forum.guitarplayer.ru/index.php?topic=219514.180	Shlyapa	 Цитата: Zodchy от Марта 05, 2012, 19:00:30 то есть? не понял немного совета. Сделай вот так: **IMAGE** 	True	False	0	1
http://forum.guitarplayer.ru/index.php?topic=219514.195	Hoop	 Zodchy, Попробуй поменять струны....у меня похожая фигня была...с заменой струн все стало нормально **IMAGE** 	True	False	0	1
http://forum.guitarplayer.ru/index.php?topic=219514.195	Zodchy	 Shlyapa, Всё, понял. интересно, как его повернуть. Не могу догадаться Hoop, да я же вроде довольно дорогие поставил, и им месяц всего **IMAGE** 	True	False	0	1
http://forum.guitarplayer.ru/index.php?topic=219514.195	Terravill	 Zodchy, откручивай винт регулировочный, переворачивай седло, закручивай обратно винт 	False	False	0	1
http://forum.guitarplayer.ru/index.php?topic=219514.195	Shlyapa	 Цитата: Terravill от Марта 05, 2012, 21:24:14 Zodchy, откручивай винт регулировочный, переворачивай седло, закручивай обратно винт Там ещё или пружинку-проволочку надо снять (она одна на все шесть винтов), либо, как в моём случае, шайбу фиксирующую с винта сдёрнуть — не так-то оно просто оказалось из-за размера и расположения. Но нет ничего невозможного. 	False	False	0	1
http://forum.guitarplayer.ru/index.php?topic=219514.195	Zodchy	 Всё, ребята, разобрался. Перевернул седло, но это ничем не помогло. Потом просто опустил пластинку с винтами вниз, И все струны настроены. 	False	False	0	1
http://forum.guitarplayer.ru/index.php?topic=219514.195	Wildelir	 а у меня винт на бридже расшатался **IMAGE** у 6ой струны (только это не винт который регулирует мензуру, а меленький стержень который вкручивается в седло сверху - 2 стержня в каждое седло) никакого другого способа, как небольшими плоскогубцами подкрутить не вижу, а наверно есть спец. мини ключи или что-то вроде этого **IMAGE** 	True	False	0	1
http://forum.guitarplayer.ru/index.php?topic=219514.195	Terravill	 Wildelir, купи набор маленьких отверток можно рублей за 200 найти (шлицевые, крестовые, шестигранники, звездочки), чтобы были шестигранники от самого мелкого там должна быть правильная насадка, не ломай плоскогубцами. а набор потом и по хозяйству пригодится 	False	False	0	1
http://forum.guitarplayer.ru/index.php?topic=219514.195	Wildelir	 значит он существует **IMAGE** 	True	False	0	1
http://forum.guitarplayer.ru/index.php?topic=219514.195	Terravill	 Wildelir, вот такой если увидишь - бери, я уже несколько лет пользуюсь **IMAGE** 	True	False	0	1
http://forum.guitarplayer.ru/index.php?topic=219514.195	karamba1985	 клевуый наборчик. заказал где или просто в хозяйственном купил? 	False	False	0	1
http://forum.guitarplayer.ru/index.php?topic=219514.195	Terravill	 karamba1985, в переходе в метро **IMAGE** 	True	False	0	1
http://forum.guitarplayer.ru/index.php?topic=219514.195	NTN	" На официальном сайте Gibson есть весьма полезное руководство по настройке электрогитар. Так как многие мучаются с дребезжанием струн выложу краткие выдержки, которые могут помочь (по крайней мере владельцам Les Paul и SG): - для проверки прогиба грифа необходимо зажать шестую струну (E) на втором и шестнадцатом (последний лад в области где гриф непосредственно примыкает к корпусу электрогитары) ладу. Расстояние в районе седьмого-девятого лада должно быть минимальным (""на волоске"" в оригинальном тексте); - приблизительные значения высоты струн на двенадцатом ладу должны составлять 3/64"" (1,2 мм) для первой струны и 5/64"" (2 мм) для шестой струны; - расстояние от нижней части струн до звукоснимателей должно составлять 3/64"" (1,2 мм). http://www.gibson.com/backstage/tech002printable.htm "	False	False	0	1
http://forum.guitarplayer.ru/index.php?topic=219514.195	EHOT	" Цитата: NTN от Марта 22, 2012, 10:34:21 - расстояние от нижней части струн до звукоснимателей должно составлять 3/64"" (1,2 мм). Надо только добавить ""при струнах, прижатых на последнем ладу"". **IMAGE** "	True	False	0	1
http://forum.guitarplayer.ru/index.php?topic=219514.195	1Otis1	 подскажите хороший компьютерный тюнер для электрогитары с подключением, можно и большую программу 	False	False	0	1
http://forum.guitarplayer.ru/index.php?topic=219514.195	Wildelir	 прога - тюнер 	False	False	0	1
http://forum.guitarplayer.ru/index.php?topic=219514.210	1Otis1	 МузЛэнд Wildelir у меня стоит че по серьезней нет или ему можно доверять? мне просто еще бридж телека приходиться равнять, а не на одной струне он не зависал на 0, наверное из-за колебаний тухнувших 	False	False	0	1
http://forum.guitarplayer.ru/index.php?topic=219514.210	Hoop	 1Otis1, не нравится софтовый тюнер - купи штатный, делов на 15 баксов **IMAGE** ....а вообще все они нормальные...принцип работы то элементарный! 	True	False	0	1
http://forum.guitarplayer.ru/index.php?topic=219514.210	Wildelir	 хз мой тюнер от музленда , меня полностью ломает устраивает) или да можешь тупо купить китайскей тюнер электронный(который крепится к голове грифа) 	False	False	0	1
http://forum.guitarplayer.ru/index.php?topic=219514.210	manzana3000	 спасибо за статью по настройке и прогибу.хоть и раньше читал.здесь очень доступно и просто. **IMAGE** 	True	False	0	1
http://forum.guitarplayer.ru/index.php?topic=219514.210	FleNdeR	 Глупый вопрос-какая средняя высота струн при строе Drop ДО, допустим на струнах 12-54 и мензуре 25.5? как по-вашему, допустим ли дребезг? 	False	False	0	1
http://forum.guitarplayer.ru/index.php?topic=219514.210	manzana3000	 посмотрел на второй гитаре там отрицательный прогиб-сруны лежат на грифе. еще раз автору спасиб. **IMAGE** ... и добавил: 	True	False	0	1
http://forum.guitarplayer.ru/index.php?topic=219514.210	alaken	 Гитара Pacifica 112V, прогиб грифа визуально со стороны первой струны больше то есть его видно когда держишь гитару как скрипку, а со стороны шестой струны практически ровный, ослабление анкера ничего не меняет, он просто выкручивается. У меня поведеный гриф или неисиправен анкер. Что делать отправлять гитару обратно? 	False	False	0	1
http://forum.guitarplayer.ru/index.php?topic=219514.210	Terravill	 alaken, сделай фото 	False	False	0	1
http://forum.guitarplayer.ru/index.php?topic=219514.210	Ardentis	 Подскажите в чем может быть проблема. Опишу все по порядку. Купил струны DR 13-56, расчитывал их поставить в строй С. Вроде все нормально, струны не висят соплями, но вот беда, шестая струна абсолютно не строит по тюнеру. Если на открытой тюнер показывает 0.1-0.5 цента( использую AP Guitar Tuner на ПК) то на 12 ладу значение показывает +20-25 цента. В чем проблема? Прогиб анкера есть, вроде все в порядке. Но не строит и все тут. Уже и укорачивал и удлинял длинну струны на машинке, толку ноль. Но самое еще интересное то, что струна звучит в унисон с зажатой пятой струной на седьмом ладу, значит по идее все нормально, но почему тюнер показывает обратное? Подскажите куда мне двигаться дальше? 	False	False	0	1
http://forum.guitarplayer.ru/index.php?topic=219514.210	Terravill	 Ardentis, мензуру отстраивай, бридж какой? 	False	False	0	1
http://forum.guitarplayer.ru/index.php?topic=219514.210	Ardentis	 Бридж стандартный стратовский. Но он зафиксирован. Удивляет еще то, как бы я не крутил седло, струна расстраивается, я ее опять настраиваю нормально, и 12 лад опять не строит. 	False	False	0	1
http://forum.guitarplayer.ru/index.php?topic=219514.210	Terravill	 Ardentis, хммм я 11-54 на гибсоновской мензуре ставил и то струны не висели в До... вообще попробуй кого-то тюнер другой взять (с 6-й струной бывают проблемы) или попробуй настроить по слуху или другой калибр / производителя струн... 	False	False	0	1
http://forum.guitarplayer.ru/index.php?topic=219514.210	Ardentis	 Terravill А может еще как то влиять наводки компа? Может действительно попробую другой тюнер или хотябы на слух. Всеравно спасибо за советы. 	False	False	0	1
http://forum.guitarplayer.ru/index.php?topic=219514.210	Terravill	 Ardentis, начни с малого, сразу напрашивается мензура, но для толстых струн слишком много факторов... 	False	False	0	1
http://forum.guitarplayer.ru/index.php?topic=219514.210	Hoop	 Ardentis, и что всегда, куда бы не крутил на 12 ладу 20-25 центов отклонение?....я бы строид мензуру...и попробуй другой тюнер....если не поможет то пробуй другие комплекты струн))) 	False	False	0	1
http://forum.guitarplayer.ru/index.php?topic=219514.225	alaken	 Цитата: Terravill от Апреля 02, 2012, 13:18:05 alaken, сделай фото мои потуги не увенчались успехом... как ни пытался сделать фото именно с того ракурса с которого сам смотрю, автофокус камеры все замыливает, другого аппарата нет... **IMAGE** **IMAGE** **IMAGE** **IMAGE** **IMAGE** 	True	False	0	1
http://forum.guitarplayer.ru/index.php?topic=219514.225	Hoop	 alaken, ну млин...нифига не видать в таких ракурсах.... 	False	False	0	1
http://forum.guitarplayer.ru/index.php?topic=219514.225	Terravill	 alaken, ну если я что-то понял из этих фото тебе наоборот нужно затягивать анкер а не ослаблять... 	False	False	0	1
http://forum.guitarplayer.ru/index.php?topic=219514.225	Ardentis	 Hoop Да. Двигаю седла, струна соответсвенно расстраивается, я по открой все строю, 12 лад опять с отклонением. Если другой комплект, то какой посоветуете в строй С. 	False	False	0	1
http://forum.guitarplayer.ru/index.php?topic=219514.225	alaken	 Цитата: Terravill от Апреля 03, 2012, 13:54:52 alaken, ну если я что-то понял из этих фото тебе наоборот нужно затягивать анкер а не ослаблять... если анкер затягивать то гриф будет уменьшать прогиб, так в инструкции написано **IMAGE** дело в том что со стороны первой струны я вижу прогиб а со стороны шестой гриф видится абсолютно ровным, пробовал зажимать струны на первом и последнем ладу со стороны первой струны зазор над седьмым ладом больше примерно на треть миллиметра чем зазор над седьмым ладом при зажатой шестой струной на первом и последнем ладах... 	True	False	0	1
http://forum.guitarplayer.ru/index.php?topic=219514.225	Terravill	 alaken, не на первом и последнем а на первом и на месте склейки нужно зажимать... 	False	False	0	1
http://forum.guitarplayer.ru/index.php?topic=219514.225	alaken	 Цитата: Terravill от Апреля 03, 2012, 14:30:41 alaken, не на первом и последнем а на первом и на месте склейки нужно зажимать... а разница в чем? линейку прикладывал зазор между линейкой и 7м ладом со стороны первой струны примерно 0.8 мм со стороны шестой 0.3 мм, этих фактов достаточно чтобы определить поведен гриф или нет? 	False	False	0	1
http://forum.guitarplayer.ru/index.php?topic=219514.225	Terravill	" alaken, подтяни анкер, дерево может не равномерно ""выравниваться"", только без фанатизма "	False	False	0	1
http://forum.guitarplayer.ru/index.php?topic=219514.225	alaken	" Цитата: Terravill от Апреля 03, 2012, 14:38:31 alaken, подтяни анкер, дерево может не равномерно ""выравниваться"", только без фанатизма подтянул, гриф выгнулся, линейка как качеля начала качаться над 7м ладом со стороны первой струны и на 10м со стороны шестой струны... вы мне скажите это приемлемо? и что будет если я поставлю струны по серьезней? ослабил анкер снова в принципе струны не звенят, смущает лиш то, что прогиб разный со стороны первой струны и со стороны шестой... "	False	False	0	1
http://forum.guitarplayer.ru/index.php?topic=219514.225	Gnot	 У меня такие настройки: расстояние между 6-й струной и порожком 7-го лада (при этом зажат 1-й и 20-й лад) около 0, 4мм(может чуть меньше). Расстояние между посленим порожком и 6-й струной около 3мм. Между первой-около 2 мм. При этом струны не звенят. Если опустить бридж, то струны будут звенеть. Гитара Epiphone sg Special. Настройки нормальные или струны высоко подняты? Еще -все струны отлично строят по мензуре. За исключением 3-й струны. На 12-м ладу она всегда чуть высит, как ни крути седла. Проблема с нулевым порожком? 	False	False	0	1
http://forum.guitarplayer.ru/index.php?topic=219514.225	manzana3000	 сегодня попробывали у друга крутить на ослабление против часовой-анкерная гайка оказалось открученной. по идее гриф должен быть закручен. а у нас при открученной гайке он прямой- струны лежат. 	False	False	0	1
http://forum.guitarplayer.ru/index.php?topic=219514.225	Terravill	 Gnot, да вроде бы все в пределах нормы... **IMAGE** manzana3000, ну нормально, значит анкер выгибает в итоге в правильную сторону... 	True	False	0	1
http://forum.guitarplayer.ru/index.php?topic=219514.225	Gnot	 Цитата: Terravill от Апреля 03, 2012, 21:54:38 Gnot, да вроде бы все в пределах нормы... **IMAGE** в струны не слишком высоко подняты? 	True	False	0	1
http://forum.guitarplayer.ru/index.php?topic=219514.225	Shlyapa	 Цитата: Gnot от Апреля 03, 2012, 21:58:16 в струны не слишком высоко подняты? Обсуждали тут за углом и всякие там фирмовые рекомнедации цитировали — типа, многовато это. Но лично у меня примерно так же, как у тебя. Фломастеры. © 	False	False	0	1
http://forum.guitarplayer.ru/index.php?topic=219514.225	Terravill	 Цитата: Gnot от Апреля 03, 2012, 21:58:16 в струны не слишком высоко подняты? ну если над последним ладом мерить я думаю у меня около того же... может на 0,5 мм ниже... **IMAGE** 	True	False	0	1
http://forum.guitarplayer.ru/index.php?topic=219514.240	manzana3000	 Terravill, ну нам пришлось машину чуть поднять. 	False	False	0	1
http://forum.guitarplayer.ru/index.php?topic=219514.240	Terravill	 manzana3000, сейчас все нормально? 	False	False	0	1
http://forum.guitarplayer.ru/index.php?topic=219514.240	manzana3000	 Terravill, да ок. началось с того что у него внезапно забэмкала вторая стуна. проверили как написано на первом ладу и в месте входа грифа. никаких зазаров. ну я же ученый теперь-говорю отпускаем анкер. снимаем крышку. а анкерная гайка вообще не прикручена. куда дальше отпускать?. короче чуть ее подтянули чтоб не болталась и опустили машины. дребезг прошел. связываем это с тем что у предыдущего хозяина стояли толстые струны и анкер постепенно распрямился.? единственное что 4 месяца он распрямлялся. ведь на прошлой репе струны не дребезжали. а как то все внезапно произошло. 	False	False	0	1
http://forum.guitarplayer.ru/index.php?topic=219514.240	Terravill	 manzana3000, **IMAGE** чета из разряда мистики **IMAGE** ) 	True	False	0	1
http://forum.guitarplayer.ru/index.php?topic=219514.240	manzana3000	 Terravill, сам не понял. с декабря играл . все нормально. на прошлой репе струна подсела. гитару вроде не роняли. все померел по инструкции. вскрыли анкер-гайка болтается. по идее если ее крутить то он в отрицательный прогиб уйдет. поэтому пару оборотов наживили. и опустили машины под зазор 2мм на 12ладу. все в норме. хз. гитара не из дешевых. 1800 бакарей 	False	False	0	1
