http://forum.guitarplayer.ru/index.php?topic=219514.90	brut1	 Парни спасибо вам большое **IMAGE** , поставил потолще струны 10-46 , я просто счастлив **IMAGE** ,вообще пропал весь дребе3г , все просто супер, не нарадуюсь. Сейчас сижу высоту струн и мензуру отстраиваю **IMAGE** . А так все супер . Респект Вам мужики. Походу 10-46 мой калибр **IMAGE** 	True	False	0	1
http://forum.guitarplayer.ru/index.php?topic=219514.90	Terravill	 brut1, да можно было и 9-46 ставить **IMAGE** но подошло, значит - подошло **IMAGE** 	True	False	0	1
http://forum.guitarplayer.ru/index.php?topic=219514.90	Shlyapa	 Цитата: Terravill от Января 27, 2012, 16:37:21 Shlyapa, дык я для того и написал: канеш если они вылезли стерлись или гриф закрутило - будет пофигу что там на 12 ладу... Или в верхнем порожке пропилы слишком глубокие. Три возможные причины. Ты назвал две, я присовокупил третью. **IMAGE** 	True	False	0	1
http://forum.guitarplayer.ru/index.php?topic=219514.90	Terravill	 Shlyapa, **IMAGE** 	True	False	0	0
http://forum.guitarplayer.ru/index.php?topic=219514.90	akl	 везде пишут, что верхний порожек надо смазывать графитовой смазкой. А обычным минеральным маслом можно? или оно слишком жидкое для этого? 	False	False	0	1
http://forum.guitarplayer.ru/index.php?topic=219514.90	Terravill	 akl, смазывай графитовой, к чему эксперименты? 	False	False	0	1
http://forum.guitarplayer.ru/index.php?topic=219514.90	akl	 за графитовой надо в магазин идти, а на улице -25 **IMAGE** 	True	False	0	0
http://forum.guitarplayer.ru/index.php?topic=219514.90	Freemen	 Струны 9-46 вроде, не помню уже. настроил все как здесь, первая струна зажатая на 1 ладу цепляется за второй, чего не замечается на остальных струнах и ладах. Что это может быть? Мастеру возил, он шлифанул лады, настраивал прогиб, высоту, та же фигня. ... и добавил: Вроде настроил так как надо, но все равно по мне так высота над 15 ладом большевата для 1 струны, и проблема насколько я слышу не устранена полностью ... и добавил: Хотя думаю очень сильно поможет замена гитары))) ... и добавил: Т.к. у меня Washburn WV40 Индонезия 	False	False	0	1
http://forum.guitarplayer.ru/index.php?topic=219514.90	zett	 Здарова дрУги! **IMAGE** Имею небольшой вопрос по Fender Stratocaster American standart. Подскажите, как идеологически правильно выставить высоту тремоло относительно корпуса? Сейчас стоИт с зазором около 3-4 мм, рычагом можно работать и вверх, и вниз, причем строй почти не уходит (максимум на 2-5 центов). Но струны высоковато находятся, примерно на 3-мм над последним ладом. Мне это не очень удобно. Короче, ломаю голову, шо кошерней - положить тремоло или опустить седла? Да, немного об своих идеалах... Гилмор, Блэкмор, Нопфлер. **IMAGE** 	True	False	0	1
http://forum.guitarplayer.ru/index.php?topic=219514.90	SteelKnight	 brut1, так ты сам все и сделал **IMAGE** Износишь эти струны, можешь поставить 9-46 - у них 4-6 струны как у десятки, так что дребезга не будет, зато приятнее будет играть на 1-3 струнах. Сам долго играл на 9-46 - имхо самый универсальный комплект ... и добавил: akl, ну потеплеет, тогда и прикупи. **IMAGE** Потому что масло - смысла нет - слишком жидкое. Графит-то со временем из порожка вытирается, а уж про масло и говорить нечего. 	True	False	0	1
http://forum.guitarplayer.ru/index.php?topic=219514.90	Terravill	 Freemen, гриф ровный? лады не вылезли? что мастер сказал? 	False	False	0	1
http://forum.guitarplayer.ru/index.php?topic=219514.105	Freemen	 Ровный, не вылезли, мастер ничего не сказал, он то ее настроил, но проблема осталась, на всех ладах нормально, на первом зажмешь цепляется 	False	False	0	1
http://forum.guitarplayer.ru/index.php?topic=219514.105	brut1	 Цитата: Freemen от Января 30, 2012, 11:24:22 Ровный, не вылезли, мастер ничего не сказал, он то ее настроил, но проблема осталась, на всех ладах нормально, на первом зажмешь цепляется я вот недавно мучался с дребезгом , но у меня был ужасный дребезг от открытой 5 струны. Поставил потолще , помогло, все супер, но первые три струны я не менял, тоесть стои т комплект 9-46. В твоем случае я бы сделал следующее, чутка ослабил бы анкер , поверни гайку против часовой стрелки. Ну и попробуй чутка подни саму струну.А вообще не пойму ,у меня первые струны тоже звенят немного ,но это нормально, механический звон никуда не денется. В комбике слышно дребезг ? Ппробуй записать, или тупо лупер включи ( если есть ). Я был у мастера у него несколько гитар, некоторые из них были Вадика Сергеева (Сплин) Так вот на этих гитарах, профессионального музыканта, звенело похлеще меой гитары при неподключении к усилку,а при подключении все норм. Так что не парься ... и добавил: Еще многое зависит от звукоизвлечения **IMAGE** 	True	False	0	1
http://forum.guitarplayer.ru/index.php?topic=219514.105	Hoop	 Freemen, Что ж за мастер то такой?...раз звенит после настройки - его бока, должен был устранить! 	False	False	0	1
http://forum.guitarplayer.ru/index.php?topic=219514.105	Terravill	 Цитата: Hoop от Января 30, 2012, 11:40:14 Freemen, Что ж за мастер то такой?...раз звенит после настройки - его бока, должен был устранить! или объяснить 	False	False	0	0
http://forum.guitarplayer.ru/index.php?topic=219514.105	Hoop	 Terravill, 100% - рекламацию ему! пущай переделывает! **IMAGE** **IMAGE** **IMAGE** Эко народ недобросовестный пошел! 	True	False	0	0
http://forum.guitarplayer.ru/index.php?topic=219514.105	zett	 Короче, я вашего совета так и не дождался... опустил тремоло на пару оборотов винтов вниз. Сафсем другое дело - струны так низЕнько-низЕнько над ладами висят... одно удовольствие играть... А машинкГой йа ффсе равно не пользуюсь... **IMAGE** 	True	False	0	1
http://forum.guitarplayer.ru/index.php?topic=219514.105	Freemen	 Все) Я решил проблему со своей гитарой))) ... и добавил: ПРодам ее нафиг и куплю Schecter Damien 6))) **IMAGE** 	True	False	0	0
http://forum.guitarplayer.ru/index.php?topic=219514.105	brut1	 Цитата: Freemen от Января 31, 2012, 12:29:37 Все) Я решил проблему со своей гитарой))) ... и добавил: ПРодам ее нафиг и куплю Schecter Damien 6))) **IMAGE** Подкопи немного и купи лучше **IMAGE** 	True	False	0	0
http://forum.guitarplayer.ru/index.php?topic=219514.105	SteelKnight	 zett, так если не пользуешься, клади машинку прямо на деку да покрепче - лес полом будет петь 	False	False	1	0
http://forum.guitarplayer.ru/index.php?topic=219514.105	brut1	 Цитата: SteelKnight от Января 31, 2012, 15:39:03 zett, так если не пользуешься, клади машинку прямо на деку да покрепче - лес полом будет петь Всмысле вообще опустить до конца машинку ? 	False	False	0	0
http://forum.guitarplayer.ru/index.php?topic=219514.105	Terravill	 в смысле закрутить болты фиксирующие тремоло, чтобы у машинки не было хода ЗЫ: добавил PDF по настройке гитар Фендер, если у кого-то есть такие же по другим производителям, кидайте в тему, добавлю в шапку 	False	False	0	0
http://forum.guitarplayer.ru/index.php?topic=219514.105	Freemen	 Цитата: brut1 от Января 31, 2012, 13:15:21 Подкопи немного и купи лучше **IMAGE** У меня не большой уровень для японца, и тем более я шектер хочу 	True	False	0	0
http://forum.guitarplayer.ru/index.php?topic=219514.105	Hoop	 Freemen, Уровень то растет постепенно?....Если так - главное что бы финансы позволили менять палки соответственно росту **IMAGE** 	True	False	0	0
http://forum.guitarplayer.ru/index.php?topic=219514.105	SteelKnight	 brut1, Цитата: Terravill от Января 31, 2012, 16:09:01 в смысле закрутить болты фиксирующие тремоло, чтобы у машинки не было хода ЗЫ: добавил PDF по настройке гитар Фендер, если у кого-то есть такие же по другим производителям, кидайте в тему, добавлю в шапку По-моему, маленько не так делать надо. Надо закрутить сильнее болты, которые держат пружины под задней фальш-панелью - тогда на деку ляжет задняя часть тремоло, а если крутить болты у бриджа, то зад только сильнее задерется. 	False	False	0	1
http://forum.guitarplayer.ru/index.php?topic=219514.105	Terravill	 SteelKnight, от чего она должна задраться? если все нормально настроено и тремоло параллельно корпусу, просто затягивай болты и машнка ляжет как сзади так и спереди на корпус... естественно можно начать с пружин, если задрана... **IMAGE** 	True	False	0	1
http://forum.guitarplayer.ru/index.php?topic=219514.120	SteelKnight	 Terravill, просто у меня передняя часть тремоло (которая ближе к датчикам) чуть скошена и если здесь затягивать болты, то задняя часть приподнимается. Болты, конечно, надо подтянуть, но перетягивать их нельзя, т.к. здесь крепеж крепче (если можно так выразиться), чем сила стягивания пружин с другой стороны. 	False	False	0	1
http://forum.guitarplayer.ru/index.php?topic=219514.120	Terravill	 SteelKnight, добавь еще 2 пружины **IMAGE** 	True	False	0	0
http://forum.guitarplayer.ru/index.php?topic=219514.120	Freemen	 Все вроде ништяк)) Немного подтянул анкер, струны низенько стали)) Не идеал конечно, но играть гораздо легче))) На перегрузе при сильной атаке конечно заметно что струна дребезжит, но при нормальной атаке норм) Все равно на первом ладу не играю можно сказать))) 	False	False	0	1
http://forum.guitarplayer.ru/index.php?topic=219514.120	LinX	 Собственно, как опускать струны на бридже типа hardtail. В том смысле, что на каждое седло по 2 шестигранника, и как опустить все струны одинаково? 	False	False	0	1
http://forum.guitarplayer.ru/index.php?topic=219514.120	Freemen	 на глаз 	False	False	0	1
http://forum.guitarplayer.ru/index.php?topic=219514.120	Evgenii857752	 Извините если была информация , а я не нашёл .... Есть ли более точная информация по настройке гитар , бас гитар .... Например настройка анкера , я 3 варианта уже нашёл , а как правильнее х.з. 1 вариант) зажимаем струну на 1 и последнем ладу , смотрим на 12 лад... 2 вариант ) зажимаем струну на 1 и 18,19 ладу и смотрим на 6 , 7 лад 3 вариант, видел в ютубе) зажимаем струну на 1 и 12 ладу и постукиваем пальцем на 6 ладу , приблизительно настраиваем зазор по ощущениям.. Так ...., с мензурой понятно ... идём дальше ... теперь про наболевшее , как правильно настроить высоту струн **IMAGE** Извините , если Вас уже тошнит от этого ... Но кто-то меряет высоту над 12 ладом , кто-то над 15 и .т.д ... А как правильнее ? Какая высота , ведь диаметр струн разный и высота должна быть разная ... Высота звукоснимателей тоже не однозначный вопрос , сколько смотрел всегда по разному . При этом какими критериями пользоваться непонятно ... Короче , где можно найти грамотную информацию по настройки бас гитары , электро гитары **IMAGE** 	True	False	0	3
http://forum.guitarplayer.ru/index.php?topic=219514.120	Terravill	 Evgenii857752, ты статью на первой странице читал? 	False	False	0	1
http://forum.guitarplayer.ru/index.php?topic=219514.120	Evgenii857752	 PDF не смотрел ..... 	False	False	0	1
http://forum.guitarplayer.ru/index.php?topic=219514.120	Terravill	 не пдф а то, что я написал? 	False	False	0	1
http://forum.guitarplayer.ru/index.php?topic=219514.120	Evgenii857752	 Terravill, Читал ... Нового там не нашёл для себя .... А посмотрев ролики на ютубе увидел, что делают и по другому ... 	False	False	0	1
http://forum.guitarplayer.ru/index.php?topic=219514.120	Terravill	 Evgenii857752, ну раз нового не нашел, тупо по инструкции сделай и все **IMAGE** 	True	False	0	1
http://forum.guitarplayer.ru/index.php?topic=219514.120	Evgenii857752	 Terravill, Так и делаю , но хотелось бы знать информацию которой пользуются мастеровые дядьки , у них там щупы разные , шаблоны ... **IMAGE** 	True	False	0	1
http://forum.guitarplayer.ru/index.php?topic=219514.120	Terravill	 Цитата: Evgenii857752 от Февраля 15, 2012, 22:41:54 Terravill, Так и делаю , но хотелось бы знать информацию которой пользуются мастеровые дядьки , у них там щупы разные , шаблоны ... **IMAGE** ОМГ ты реально думаешь, что кто-то парится с шаболнами и прочей фигней? 	True	False	0	1
http://forum.guitarplayer.ru/index.php?topic=219514.120	Evgenii857752	 Terravill, Посмотри на ютубе видиео всякие ... забугорные ... 	False	False	0	1
http://forum.guitarplayer.ru/index.php?topic=219514.120	Terravill	 Evgenii857752, давай ссылки в тему, может кому-то тоже интересно будет... 	False	False	0	1
http://forum.guitarplayer.ru/index.php?topic=219514.135	Evgenii857752	 Terravill, Да я их что запоминал ...... Там один мужик вообще порожек верхний стачивал , при этом мерил щупом зазор на первом ладу на 4 и 1 струне ... нафига он это делал , не просто так же .. 	False	False	0	1
http://forum.guitarplayer.ru/index.php?topic=219514.135	SteelKnight	" Evgenii857752, соглашусь с Terravill. Особо точные инструменты не нужны. Моя гитара вообще особенная - если сильно анкер отпустить, звук будет мясным как и должно быть у настоящего лес пола, но сустейн после 7 лада пропадает напрочь; если перетянуть анкер, сустейна будет выше крыши, но звук гитары будет зажатым, плоским, невыразительным, обедненным обертонами. Поэтому, я вообще на слух ищу золотую середину без всяких там штангенциркулей. Если вы не видите разницу в звуке от кручения анкера, тогда делайте гриф прямым, ибо так играть удобнее по всей его длине. По высоте струн - у меня струны очень низко - так, что звенят. Это нормально, потому что имеем дело все-таки не с акустикой, а с электрогитарой. Струны нужно опускать как можно ниже, но чтобы это было без ущерба для звука. Т.к. мы же музыканты и самое главное для чего все это делается - это звук. Правильная настройка анкера позволяет буквально ""положить"" струны на лады, тогда любое легато вы сыграете без проблем и звук будет обалденный. "	False	False	0	1
http://forum.guitarplayer.ru/index.php?topic=219514.135	Evgenii857752	 Цитата: SteelKnight от Февраля 17, 2012, 09:00:37 . Если вы не видите разницу в звуке от кручения анкера, тогда делайте гриф прямым, ибо так играть удобнее по всей его длине. Анкер и должен быть настроен так , что бы играть по всей длине и струны расположены так чтоб на клине не дребезжали и на драйве всё в порядке было ... Если Вы настраиваете свою гитару от балды , то пожалуйста ... Но хотелось бы это делать по науке ... И если вы не слышите разницы в разной высоте звукоснимателей **IMAGE** ..... я слышу 	True	False	0	1
http://forum.guitarplayer.ru/index.php?topic=219514.135	SteelKnight	 Evgenii857752, зря вы так. Я вам помочь хотел, а вы... Настраивайте по вашим линейкам как хотите. Кто вам не дает? Удачи. 	False	False	0	1
http://forum.guitarplayer.ru/index.php?topic=219514.135	Shlyapa	 Цитата: SteelKnight от Февраля 17, 2012, 09:00:37 По высоте струн - у меня струны очень низко - так, что звенят. Это нормально, потому что имеем дело все-таки не с акустикой, а с электрогитарой. Струны нужно опускать как можно ниже, но чтобы это было без ущерба для звука. От дребезга как раз и ущерб. Отстраивать высоту струн и прогиб грифа надо на неподключенной гитаре. А потом, подключив, переходить к отсройке высоты звукоснимателей. 	False	False	0	1
http://forum.guitarplayer.ru/index.php?topic=219514.135	SteelKnight	 Shlyapa, струны абсолютно не звенят только если они очень высоко подняты. В этом случае играть будет неудобно. Ну, это мое имхо, разумеется. А на счет настройки на не подключенной гитаре, я как раз на подключенной настраиваю. Именно это дает мне возможность получить нужный мне звук, который на записи меня устраивает полностью, ибо гитара реально фирмово звучит. И все в порядке и по сустейну, и по объему звука и по удобству игры. 	False	False	0	1
http://forum.guitarplayer.ru/index.php?topic=219514.135	Shlyapa	" Звук гитары рождается в механической её части и только потом преобразуется в электрический сигнал. Я сначала отсраиваю неподключеную гитару так, чтобы она в руках себя вела так, как мне нравится — и под пальцами, и, кагрицца, на брюхе. Низко опущенные струны;струны, ложащиеся на лады между верхним порожком и пальцем, прижимающим струны (то есть гриф без прогиба — прямой) — меня это всё просто обламывает. Ты там, вроде, легато упоминал, так вот, на грифе без прогиба делать легато это вообще облом из обломов — я просто чешусь весь от такого блямзанья струн о лады. Только когда звук неподключенной гитары меня устраивает, я перехожу к настроке электрической части. Высоко струны или низко — не так давно это тут за углом обсуждалось. Там люди с весьма-весьма качественными гитарами выставляют от 1,5 до 2 мм над 12-м ладом — и ничего у них, с их слов, не звенит. Я выставляю больше — где-то примерно 2,3—2,5 мм. Во-первых, потому, что ниже начинает дребезжать (гитарка у меня поплоше, чем у тех людей), а во-вторых, мне просто не нравится ощущение под пальцами, когда струны низко. Струны у меня, если что, для настоящих мужиков **IMAGE** — 11-е, строй стандартный. "	True	False	0	1
